,episode,rev_title,rev_content,rvr_rating
0,"""Star Trek: Enterprise"" Carbon Creek (TV Episode 2002)",The Most Excellent Trek episode of All Treks,"And it embodies the Spirit of Trek, all of Gene Roddenberry's ideas are here in one fell swoop in this swell episode of ""Enterprise"".Writer/Producer Dan O'Shannon of Cheers and Frasier worked well with Brannon and Rick to create this peep into Vulcan/Human history - And not one Temporal Causality Loop, Suliban Temporal Transporter, or any Department of Temporal Investigations Agents were used, this is a true Period Piece, true to the depicted Terran History around the time of Sputnik. I know, because I lived in that time. And this is how it looked.Although T'Pol is telling this Fish Tale to Archer and Tripp, the character who wins the big prize is ""Mestral"" played by the great J. Paul Boehmer, who adds Vulcan to his list of Trek Aliens - He has been a Cardassian, a Borg, and a Nazi Soldier in Deep Space Nine, Voyager and Enterprise. This is perhaps his best character and a most Logical Vulcan.I had reviewed the Vulcan Enterprise Episodes of Season Four and had commented that the Vulcans were no longer acting like Vulcans, instead acting like angst and testosterone ridden teenagers with only Pon Farr on their minds.Here, the characters of T'Pol/T'Mir and Mestral as well as ""Stron"" (Michael Krawic) and ""Captain Tellus"" (Ron Marasco) are true Vulcans, following the standards set by Leonard Nimoy, Mark Lenard (""Sarek""), Zachary Quinto, Tim Russ, and Alexander Enberg (""Vorik"" from Voyager and ""Taurik"" from Next Generation Season 7 ""Lower Decks""). I was pleased to see this, because Leonard Nimoy had set a Standard for Vulcans in The Original Series and all of those actors had followed suit to perfection.The Season Four Enterprise ""Vulcan Trilogy"" The Forge, The Awakening, and Kir'Shara had changed Vulcans into petty, squabbling politicians and it is just not believable that they would act as they did, speak as they did, with venom and deceit.But here, they do justice to all Vulcan canon.This is why I consider this episode not just the best of Enterprise, but of the whole Trek Franchise. In The Original Series, the Vulcans were basically the heart of the show. Later, Klingons, Romulans, Ferengi, Bajorans and Cardassians and even Vorta and Jem'Hadar were added to the lists of uncountable Aliens. In all of Trek, we have seen parades of unidentified Aliens, drinking in Bars, sitting at the Helm, walking the corridors of The Enterprises, Serving bar in Ten Forward, and as Senators serving the Federation Council and even as Presidents of the Federation.This episode was presented without gimmicks, without Technobabble and with a lot of Humanity. And it is probably the most touching depiction of T'Pol in the whole run of the show.In making shows about Aliens, Trek quite successfully at times reflects on The Human Condition-Especially in the Interactions with ""Hoomans"". In Quark we saw a Barkeep with real heart, in Odo, we could see the Entire Human Race and that the good outweighs the bad. But The Vulcans are perhaps the best friends Humanity has ever had. It is in our exploration of Vulcanity that Humanity can be really be observed.Ironically, Archer and Tripp think T'Pol had pulled their legs. Vulcans can imply, obfuscate, and misdirect, but Vulcans Never Lie.",10
1,"""Star Trek: Enterprise"" Carbon Creek (TV Episode 2002)",one of my favorite episode,"Most of the Enterprise actors do not appear in this episode. With Trip and Archer playing a very small supporting role... it's all T'Pol.It's a fun well done episode. Light hearted, reminded me of ""Coneheads"", but with some touching moments (my wife cried at one scene). Much of Enterprise tries to answer question from early Star Trek Series... the first Holodeck, the beginning of transporting humans, etc; this episode does that with First Contact... making first Contact the Second Contact.***major spoilers below***I agree with the review that the ""great grandmother"" might has been T'Pol herself, her mother or T'Pol might even be the daughter of the Vulcan who was left behind. It would have been fun if they would have come back to this episode in a later show.",9
2,"""Star Trek: Enterprise"" Carbon Creek (TV Episode 2002)",My favorite Star Trek episode.,"Identifying what is or is not one's favorite of anything is strictly a personal endeavor. I'm more than sure I'm probably the only trekkie/er on the planet (or universe) that identifies 'Carbon Creek' as their favorite Star Trek episode.It seems the least expensive episodes ring stronger for me. TNG's Inner Light, ENT's Shuttlepod One, DS9's Explorer's, VOY's 11:59 to name a few.Carbon Creek wasn't just a ""filler"" episode made to conserve money to make up for other more graphic intensive episodes, it had a purpose. This episode not only revealed some interesting unknown Star Trek history, but provided a needed back-story for the character T'Pol.This is a wonderful, heartwarming story. At this point in the series, T'Pol continually takes abuse for being 'Vulcan' even though she has time and time again proved unwavering loyalty to her Captain, the mission and the crew of Enterprise. So why does she put up with this? Until this episode we really had no idea and didn't know much about her background at all.While she doesn't reveal the 'truth' to Archer and Trip over dinner, she does indicate to us by revealing her ""mother's mother's mother's"" purse that the story she has told us is true. One can only imagine the impact her grandmother had on a young T'Pol, telling stories of her experiences with humans, etc. Now we can surmise why she volunteered to serve on Enterprise and moreover why she decided to remain aboard when she has had the opportunity to leave. T'Mir was an explorer that ended up gaining firsthand experience with humans while being stranded on Earth in 1957. Humans intrigued her and she passed that curiosity and interest on to her granddaughter.We see how important education is to T'Mir and we see how she just can't fathom that a brilliant kid wouldn't be afforded an opportunity to receive a higher education. T'Mir's introduction of Velcro technology fit nicely into history as we know it. The first Velcro was completely made from cotton when Georges de Mestral, a Swiss engineer, patented the zipperless zipper 1955. The problem was the cotton hooks quickly stopped doing what Velcro does as they quickly wore out. Nylon had been around since 1935. It wasn't until shortly after Velcro was patented that Mestral discovered that nylon worked much better than cotton (circa 1958) because it didn't wear out nearly as fast with use. Seeing Maggie's expression as she found the money in the tip jar realizing her son could go to college was priceless.Listening to baseball on the radio, bus rides, 'I Love Lucy', 'Moe', old vehicles, frozen fish sticks, family owned restaurants, the small coal-town atmosphere all added to the realness of this episode. The lighter tone during the encounters between humans and our Vulcans was fun.It would have been nice for the series to revisit Mestral, but they did not. We can only assume he melded in nicely and contributed to human advancement where he could.So this episode links Star Trek's future with humanities past and provides back-story for a main character that gives some justification for her continued interest in serving with humans on a star ship. All done with humor and knowledge of our real past that makes this occurrence as plausible as they come in trek.Well done, Rick Berman & Brannon Braga & Dan O'Shannon, well done. So the next time you see T'Pol unveil her Great Grandmother's purse, I hope you give this review a thought and I hope you might appreciate this Star Trek gem little more.",10
3,"""Star Trek: Enterprise"" Carbon Creek (TV Episode 2002)",T'Pol tells a story,"This episode is frequently sited by fans of Enterprise as their favorite episode of the series. Ironically, most of the show takes place, not on the ship or even in the future, but in Earth's 1950s.The episode succeeds despite, or maybe because of, the absence of hostile aliens out to destroy earth, hostage situations, shipmates being transformed into disgusting monsters or any major violence. It's a light-hearted episode that poses a simple premise: prior to first contact a few Vulcans become trapped on earth during a survey mission and face the prospect of not being able to return home. How will they adapt? Do they interact with humans risking discovery? And it's how these questions are answered provide the conflict and make the show compelling.The main character of the story is T'Pol's Great Grandmother, but you relate to the character as being T'Pol herself, which is not unreasonable since T'Pol is telling the story. And since what we're watching is a story, any concerns about believability are irrelevant. We don't know if this is real or fiction.I loved the ending and the way they left Trip and Archer not knowing if the story is true and then that very last scene with T'Pol alone in her room.More episodes like this and less on endless protracted inter-stellar wars and the show would still be on the air.",10
4,"""Star Trek: Enterprise"" Carbon Creek (TV Episode 2002)",Quite an Episode!,"All right, I'll admit: I adored every minute of this episode. I thought it was brilliance wrapped in ingenuity.I really enjoyed the fact, first, that it took place some 200 years ago, by Enterprise's time-line. (The episodes from TOS where Kirk went back to the '60's or whatnot, or Carpenter Street, from Season 3 of ENT? Genius.) It was the not-so-original crash-landing-on-a-primitive-planet-and-we-all-have-to-fit-in plot, but it worked out /splendidly/. It also highlighted looking past what you've been told (Mestral's obvious start of some chemistry with that Maggie gal? Sarek x Amanda Grayson, much?) and really having an open mind.A very good second episode for the second season of a great series. Besides, who's to say our friend Mestral wouldn't have lived to see ""First Contact"" occur? ;D",10
5,"""Star Trek: Enterprise"" Carbon Creek (TV Episode 2002)",The Unknown First Contact,"While celebrating the first year of T'Pol in Enterprise in a dinner party with Trip and the honored guest, Archer informally asks her about her leave on Earth in the small Pennsylvanian town Carbon Creek. T'Pol tells that her great-great-grandmother T'Mir and the Vulcans Mestral, Stron and the captain of a small Vulcan aircraft that was observing the Sputnik crash on Earth in the 50's. The captain dies and the trio waits for rescue in the woods, but they are not sure whether the distress call has been really sent. When their rations finish and without means of communication, they move to Carbon Creek to get food, interacting with the inhabitants, finding job in the community and feeling the warm welcome of the gentle dwellers.""Carbon Creek"" is a great episode about the unknown first contact of Vulcans on Earth. The story is ambiguous and it is never clear whether T'Mir and T'Pol are the same character, or T'Mir is really her great-great-grandmother. Trip in some moments is very inconvenient with his observation about T'Pol age, but this query may be a clue that they are the same person. My vote is nine.Title (Brazil): ""Carbon Creek""",9
6,"""Star Trek: Enterprise"" Carbon Creek (TV Episode 2002)",Odd but quite enjoyable,"This episode is very unusual in structure and like none other. It begins with T'Pol, Trip and the Captain sharing some wine and talking. Trip encourages T'Pol to open up and tell them a story. She responds by telling them about her great-great-great grandmother who, according to the story, actually landed on Earth well before Zefram Cochran--even though history books record that he was the first human to come into contact with the Vulcans. It seems that a small Vulcan ship was covertly observing the Earth when it developed engine problems and crashed in Pennsylvania in 1957. What follows is a cute story about three Vulcans trying to blend in--and one which really seemed to take to American culture.This story isn't perfect--the ending is awfully vague and you really have no idea if this really happened or not. But, it was very entertaining and enjoyable--and is well worth seeing.",8
7,"""Star Trek: Enterprise"" Carbon Creek (TV Episode 2002)",Delightful Yarn,"To entertain the Captain and Tripp, T'Pol tells a story. It involves a place called Carbon Creek in a coal mining area. T'Pol and two other crewmen on a Vulcan ship crash a shuttle around 1956. They must figure a way to survive. So they engage with the locals, hiding their ears and working at odd jobs. One of them begins to have feelings for a single mother who owns a bar. She has a son who is trying to get to college but has few resources. They are dangerously close to blowing the whole prime directive, especially since one of them has gone rogue. T'Pol is in command because their captain died in the crash. This is a particularly fun episode as we watch the Vulcans try to fit in.",9
8,"""Star Trek: Enterprise"" Carbon Creek (TV Episode 2002)","Now Hold On Thar, Little Lady, You're Rewritin' Our History!","Lackluster episode with Tpol telling a story about her great-grandmother visiting earth before the believed designated encounter, during the 1950s.All the ideas that there were in-jokes to William Shatner appearing on Twilight Zone and I Love Lucy falls short.You might as well take the entire episode as some tongue-in-cheek reference to Scott Bakula's Quantum Leap show. It isn't there.Biggest annoyance is Tpol (supposed to be her great-grandmother? Might as well be the same character) attempting to display a lack of emotion, yet her indifference to trapped miners is definitely an emotion; indifference, callousness, insensitivity.Emotions aren't just wonderful feelings.If I were a Vulcan, I wouldn't trust either depictions of these Klingon women to bring back any worthwhile information on foreign lifeforms, as the idea 'dont get involved' falls strangely short of studying said lifeforms.Second irritation is Trip's pitiful down-hominess toward's Tpol.""If she's yore granma, how old are you?"" ""Why, captain, she just rewrote history!"" -- at a dinner table.""Captain, I think she just pulled one over on us!""",6
9,"""Star Trek: Enterprise"" Carbon Creek (TV Episode 2002)",By 2002 they should have known not to mess with canon,I was apprehensive about this episode as the story of three Vulcans crash landing on Earth in the 1950's was too much f*&%^&g with Canon for my liking and pretty much made the epic events of the film 'First Contact' seem obsolete.In actuality the episode is quite enjoyable and it's actually rather cool to see the situations the Vulcans get in but I'm afraid Berman and Braga pushed it too far by suggesting one of them stayed on Earth for the next hundred years amongst the humans.Another slap is that they gave the episode the perfect opportunity to rectify the situation by suggesting T'Pol told a made up story to affectionately fool Archer and Trip but they went and ruined it by showing concrete proof that it did in fact happen.A well made episode it may be but screwing with canon this way is the kind of dangerous and arrogant writing that makes hardcore fans give up and by 2002 they really should have know how rabidly picky Star Trek fans were about their franchise and this was probably the start of the show's gradual drift from popularity.,7
10,"""Star Trek: Enterprise"" Carbon Creek (TV Episode 2002)",Great... Up to the Last 5 Minutes,"This was on the cusp of turning into my favorite ST:E episode thus far before the ending occurred. The concept of 3 Vulcans trapped on Earth is a cool concept, a bit of a mirror on the classic ""Human Trapped on an Alien Planet"" plot. We get to see it from the opposite perspective. All the acting and set design is pretty cool and it's interesting how the Vulcans acclimate to our society as time passes.Now to the bad stuff: the end. I don't enjoy this piece of revisionist history that occurs in this episode. Leaving a Vulcan behind to live on for another 100 years had me rolling my eyes. This show gave itself an out by positing the possibility that T'Pol made all this up to entertain them. Leaving this up in the air would have been a good finish and would have left the audience wondering. By showing T'Pol with her grandmother's handbag at the end, it throws away any intrigue or opaqueness this episode contained. Now it is established that this story (at least the part about the crash landing and how Vulcans invented Velcro) is true. ST:E really ruined one of it's better episodes with this ending.",6
0,"""Star Trek: Enterprise"" Minefield (TV Episode 2002)",A Tense and Dramatic Episode,"While having breakfast with the tense and formal Reed, Captain Archer is called from the bridge by T'Pol. The Enterprise finds a Minshara planet with a volcanic hemisphere, and T'Pol waits for further instructions. Suddenly there is an explosion in the hull of the Enterprise, with the destruction of many decks and wounded crew. Archer realizes that the Enterprise is in a cloaked minefield and one mine is attached to the hull. Reed wears an EV suit to disarm the mine, but a sharp device is activated and penetrates his leg, and attaching him to the hull. Meanwhile, an aggressive Romulan ship orders the Enterprise to leave immediately that sector of the space.""Minefield"" is a tense and dramatic episode, with great performances of Dominic Keating and Scott Bakula. The story is engaging, developed in an adequate pace, and has good dialogs between Reed and Archer. My vote is eight.Title (Brazil): ""Campo Minado"" (""Minefield"")",8
1,"""Star Trek: Enterprise"" Minefield (TV Episode 2002)",One of the best of season 2,"This is one of the most well written, well paced and well acted episodes of Enterprise's second season. Unlike the typical episode involving in-house franchise writing, Minefield is story-driven, suspenseful and dramatic. Although it included some of the most annoying and absurd aspects of Enterprise - such as the crew's advanced (pre-Kirk) intelligence concerning cloaking devices - the plot gave the principal cast a rare opportunity to shine. Keating and Bakula do especially well as they work out their personal and professional relationship in the middle of a cloaked Romulan minefield with both of their lives hanging by a thread. Thankfully, the Romulans are not at all rewritten, and are not even seen in person, in this episode. The fact that no Romulan is seen during the episode is important to the fact that Enterprise is supposed to be a prequel for all the other Star Trek series. A lot of story arcs involving the Romulans depend on the relationship between the Romulans and Vulcans being slowly revealed. The Romulans are depicted as belligerent, xenophobic and unreasonable - very consistent with the earlier series.",9
2,"""Star Trek: Enterprise"" Minefield (TV Episode 2002)",One of my favorites,"I watched Enterprise from the beginning when it was broadcast. I am now seeing it for a second time on DVD. This is the best episode in the second season. Malcom and Archer are the focus of the episode, as they are put into a life-threatening situation in an alien minefield and the rest of the crew risks it all to save them. The special effects were very good, and this episode had all the characteristics that made so many of the other Star Trek series so good - good writing, intelligent back-story and lots of drama. The space sequences were especially convincing.",9
3,"""Star Trek: Enterprise"" Minefield (TV Episode 2002)",The Gang Meets the Romulans,"The Enterprise encounters an uncharted system and decides to investigate. An expedition that originally seems harmless enough quickly sours as the crew finds themselves in the middle of a minefield with a mine attached to the Enterprise hull ready to blow.The premise for the beginning of this episode was pretty neat. I'm always down for a good suspense-filled bomb-defusal; putting one in space just adds another dimension to the plot. As far as dialogue and directing goes, this episode is also pretty solid. A few questions did arise in my mind however as the episode goes along and we find out that this system is Romulan territory.Why does T'Pol not know about the Romulans or their language? Why is this system uncharted on the Vulcan database? At least mark it as ""Do Not Disturb"" or something to that effect so the Enterprise doesn't go bumbling in there. Seems kind of silly. I guess it's privileged information?The one fault of this one (besides the whole Romulan thing) is the ending. The way they get out of this sticky situation is a bit far-fetched. You think Captain Archer could have figured out a better shield to use for this, maybe land a shuttle on the hull-plating and fly away as soon as Reed was freed. I did appreciate getting some actual Reed backstory besides him being a picky eater that doesn't watch sports or have hobbies. In Season 1, he was the least three dimensional character of the main cast so it's nice to see him getting some screen time. All in all, an above average episode with a bad ending, this seems to be the Season 2 theme so far.Side Note: Reed seems like he wants to die a martyr's death. In Season 1's ""Shuttlepod One"", Reed acts similarly when him and Trip are stranded and Reed practically gives up.",7
4,"""Star Trek: Enterprise"" Minefield (TV Episode 2002)",Uninteresting,"The Brit, Malcolm, is pinned out on the Enterprise by an armed mine set by Romulans.The good old Romulans play a minor part in this episode.What is mainly supposed to be the focus is Archer (who ventured out to assist) and Malcolm bonding while the Romlulans loomed nearby.What I noted most was Trip wanting to help.Well, since Trip and Malcolm already had their bonding episode, they can't get another one now can they? So it is Archer's turn with Malcolm.Anyone who has watched endless assortments of Star Trek shows has seen episodes where a handful of crew members are given focus like this (a fave of mine from TOS, tho it did fall short, was when Kirk, Uhura and Chekov were abducted for alien wargames), yet Archer and Mal were hardly spell-binding.What seemed to be missing was something of the Enterprise itself tearing up, with Trip declaring they can't stay much longer or the warp thrusters or the anti-matter drive will explode if they continue to linger.With only Malcolm wounded outside the Enterprise and unseen Romulans the threat, the episode wasn't that suspenseful, as have endless ST shows in the past been.This far into Voyager, when I first watched it, I had favorite episodes.Hasn't happened here with Enterprise.",2
5,"""Star Trek: Enterprise"" Minefield (TV Episode 2002)",The ending is terrible but the show is otherwise good.,"When the show begins, Captain Archer is trying to get to know Lt. Malcolm Reed by sharing breakfast with him. However, Malcolm is a very dull guy who is obsessed with protocol (he would make a great match for T'Pol actually). Fortunately, this stiff and uncomfortable breakfast is cut short when the ship hits a mine! If this isn't bad enough, when the lieutenant tries to detach a mine which has attached itself to the ship, it also attached to him! The Captain (inexplicably) goes out himself to try to help--and the two finally get a chance to talk and get to know each other better. But it's not all fun and games, as the mine is still ready to explode AND several Romulan ships have appeared and are ready to blow up these 'spies'.This isn't a bad episode...until the end when the mine explodes. What happens next is pretty dumb. But the good does more than make up for the bad on this one.",6
6,"""Star Trek: Enterprise"" Minefield (TV Episode 2002)",Nobody Here But Us Romulans,"This is one of those episodes that needn't have been science fiction. It's about disarming a bomb (mine) in a limited time frame. It would have been hard enough, but the Romulans show up (we don't get to see their quilted tops). They are bound and determined to get rid of Enterprise, assuming they are conducting espionage. Malcolm has some sort of porcupine rod through his leg, forcing Archer to go out and disarm the weapon. Like a previous writer, wouldn't a transporter have worked? Anyway, there are all sorts of scientific pitfalls here. Still, it is engrossing and would be during World War II in a different setting. There is some fun interaction between the two men whose personalities are polar opposites.",6
0,"""Star Trek: Enterprise"" Dead Stop (TV Episode 2002)",Pure sci-fi glory. Superb episode!,"Now this is more like it!After the major canon faux pas of Carbon Creek it's great to see a return to some pure sci-fi.The great thing about this episode is that it is completely self contained. No big story arcs running through it and no dangerous and disrespectful shoehorning in of races like Ferengi or Romulan that hadn't even been discovered by TOS crew as seen in previous episodes of Enterprise.A very creepy vibe throughout as it is set on an unmanned and automated alien space station, the best part being that it is left open to speculation as to just who built it creating some great mystery. This is pure Star Trek and pure sci-fi glory diving headfirst in to new territory and no relying on old gags.Brilliant!",10
