,episode,rev_title,rev_content,rvr_rating
14,"""Star Trek: Enterprise"" Regeneration (TV Episode 2003)",Connection between Enterprise and Star Trek: First Contact,"This episode really divides people, and even I don't really know what to think of it. First of a lot of people hate it, because they forget or don't reanalyze that the episode is a continuation of the movie Star Trek: First Contact, so as always when time-travel is involved there will be discussions about how it changes/effects the canon we know and love where Q shows TNG the Borg. But the episode also has some really big mistakes, 1. In one scene the Borg adapted themselves to the Starfleet phasers, and then in the next scene other Borgs are killed when shot with phasers. 2. Phlox was able to cure himself of the Borg infection. There for 4/10 from me, because while I like the salute to Star Trek: First Contact, there are too many mistakes in the canon toward the Borg.",4
15,"""Star Trek: Enterprise"" Regeneration (TV Episode 2003)",Seriously,"I would imagine this will be another one of my reviews that will receive no views and no upvotes not only because of my heading but because it contains spoilers and being most of those who have rated the episode and/or left reviews are totally delusional leaves me fighting against a psychotic bunch of people.Borg would not need environmental suits for one, as soon as they had regenerated enough they would have immediately figured out a way to get a message through to the Borg collective and the Borg would have invaded the Alpha quadrant with no way to stop them from assimilating every sentient being.In all honesty just as the Stargate franchise I enjoyed the way the roles were portrayed and some of the episodes were not bad but the overall storyline made no sense often altering history to meet a narrative that appealed to irrational minds after all what do warped minds know about Federation history or actually factual history too many poisoned into believing that eventually you will be able to be of no benefit to anyone else but yourself, completely nonproductive and get financially rewarded for it.",1
16,"""Star Trek: Enterprise"" Regeneration (TV Episode 2003)","Oh, the humanity of it all....","This, is what happens when Gene Roddenberry dies and you are left with a TV Franchise and have no talent or idea on how to implement it.Rick Berman has no clue as to what makes Star Trek ""Star Trek"" - and if there is one episode where this is exemplified, it is this.The Borg went back in time to assimilate Earth. Picard killed them with Quantum Torpedoes (X4) and that Borg Sphere was utterly destroyed...but let us put that to one side for now and talk about what happens in the actual episode.So, apparently some Borg survive and crash/land in the arctic circle, freezing them until awoken, which when happens they leave Earth and try to get to Borg Space.This simply does not make any sense...their mission was to stop 'First Contact' and assimilate Earth...so why travel back to Borg Space? Why not, send a message to Borg space from Earth, but continue to Assimilate Earth? One on each continent? Multiply and slowly take over Earth? And, if you are going to change cannon, then Q would not have 'flung' Enterprise D into the borders of Guinan's home in the El-Aurian system as a lesson, as the lesson would not have made a point, because Humans would have already had 'a taste of their future'.So yeah, dumb episode and is basically what happens when you are Rick Berman and you run out of ideas, and want to try and get your viewer figures up: You create an anachronistic nightmare, alienate the fans and ruin Star Trek, again.His logic undoes his logic.",1
0,"""Star Trek: Enterprise"" First Flight (TV Episode 2003)",Enterprise finally starts to deliver on its potential,"This character development episode provides insight into Jonathan Archer, the early faster-than-light space program, and even T'pol. Emotionally disturbed over the death of a colleague, Archer descends into one of his occasional moods and clams up. For completely logical reasons, and also because she has begin to think of the captain as a friend, T'pol forces him to take her along on what he had intended to be a solo away mission. And Archer tells her a story to assuage his grief.This is one of the best episodes of Season 2. It is expertly directed by LeVar Burton, and features an interesting and original premise. Recommended!",9
1,"""Star Trek: Enterprise"" First Flight (TV Episode 2003)",The Robinson Nebula,"While going to investigate a huge dark matter, Captain Archer receives a message from Admiral Forrest informing that A.G. had died in Mount McKinley. T'Pol uses the Starfleet Rules to make companion to the grieving Archer in the shuttle pod and he tells the story of Captain A.G. Robinson and the Starfleet's NX program, when the warp engine developed by his father was tested for the first time. After a failure in his mission with the destruction of the prototype and shutdown of the program pressed by the Vulcans, Robinson helped Archer and Trip in an unauthorized flight with the second prototype.""First Flight"" is a nice episode where the test of the warp is tested for the first time successfully reaching warp 2.5, after an initial problem. What I like most is the last line of T'Pol dedicating the discovered nebula to Robinson. My vote is seven.Title (Brazil): ""Primeiro Vôo"" (""First Flight"")",7
2,"""Star Trek: Enterprise"" First Flight (TV Episode 2003)",Good.,"Although I hate flashback episodes, this one is pleasant and worth seeing. As T'Pol and Archer are on some mundane (but pretty) mission, Archer talks about his old friend, A.G. Robinson (Keith Carradine)--as he's just received word that the guy died. The story goes back about a decade before Enterprise is launched. At that time, Archer and Robinson are test pilots and they're working on a warp engine program. At first the pair are rivals and go through a stupid macho fist fight (the low point of the show) but later team up to work on the project--which is a problem as the Vulcans have convinced the humans to put this warp project on hold.This is a decent but not great episode of the show. However, while I complained about the fight, I did really like the very final line by T'Pol--it was actually rather sweet.",7
3,"""Star Trek: Enterprise"" First Flight (TV Episode 2003)",The Prequel To The Prequel,"Enterprise, as it was known without the Star Trek prefix for its first couple of years, was promoted as being a prequel series to the original Star Trek TV series. Yet for much of that same time frame, it could easily have been just another Star Trek show as the crew seemed to wander the galaxy far from home and often out of contact with Starfleet. Indeed the only way to know it was a prequel series was the less than advanced technology and the occasional first contact with one of the better known alien races of the series. Occasionally through, it would be what it was meant to be. First Flight, airing late in the show's second season, was just such an episode.When initially pitched, Enterprise was intended to be far more a prequel series than it eventually became. One of the earliest notions for the series was the idea of exploring the early days of Starfleet and the leading up to the building of the first star ship. While the idea was eventually all but scrapped, this is the closest fans would get to the original notion behind the series. Pulling inspiration from the Tom Wolffe book and 1983 film The Right Stuff, First Flight takes viewers into the early days of the NX program as Archer remembers his recently deceased friend Robinson played by actor Keith Carradine. With big changes coming to Enterprise just two episodes later in the season finale The Expanse, this might well have been the show's last (if somewhat belated) chance to tell this story.Drawing inspiration as it does from The Right Stuff, the episode works very well indeed. There's references and indeed nostalgia for those early days of space flight with scenes of Archer, Robinson and members of Starfleet sharing drinks in a bar that echo the real-life Poncho's Happy Bottom Riding Club that existed at Edwards Air Force Base during the 1940s and 1950s. The cockpit of the NX prototypes, NX Alpha and NX Beta, along with the flight suits worn by the Starfleet pilots also call to mind the early days of the space program as astronauts sat in cramped space capsules, wearing pressure suits and wondering if they might not live through the flight. Though obstinately set in the future, First Flight is full of earning to those heady days, the excitement and the danger that went along with them.It's in the flashback sequences that the episode is at its best. It's fun to watch Scott Bakula playing a younger, even reckless version of Archer who yearns to get out there and enters into a not so friendly rivalry at times with Keith Carradine's Robinson. Carradine's Robinson makes for an interesting foil for Bakula's Archer as the man are quite alike though whereas Archer is trying to live up to his father's legacy, Robinson seems most keen on just flying. Robinson comes across as a proto-Kirk in that respect, much more so than Archer ever does across four seasons of Enterprise. Also, their rivalry calls to mind that of aviators Chuck Yeager (the US pilot who became the first to break the sound barrier) and Scott Crossfield which is portrayed in the book of The Right Stuff. The episode also shows us the beginning of the friendship between Archer and Trip Tucker, something that both Bakula and Conner Trinneer play nicely. From an acting point of view, First Flight is a solid episode especially for Bakula.Where the episode is at some fault is in its structure. The episode is largely told in flashbacks, something that Enterprise had done before with its 1950s set episode Carbon Creek. Yet whereas the nature of that episode meant that interrupting the flashbacks not only worked but was necessary, here it is considerably less successful. It might be in part because the framing story, which features Archer telling T'Pol about the events while they're in a shuttlepod while investigating a dark matter nebula, might be the cause of that as the dialogue is at best functional and laughable at its worst (it might also be worth mentioning that dark matter had already been investigated in the earlier Enterprise episode Breaking The Ice but never mind). The flashback nature also undermines some of the episode's mini-cliffhangers at the commercial breaks, especially one early in the episode that is set around the apparent death of a character whom we know isn't dead that leads to an immensely melodramatic moment. The flashback structure isn't perfect but it gets the job done, even if the results are less than satisfactory at times.Despite issues with its structure, First Flight is still largely a success. The performances and the flashbacks are all solid, allowing Enterprise to tell a story quite unlike any other in its run. It's also a chance to view the series that Enterprise might have been had things gone differently, if it hadn't effectively spent years sitting on its laurels repeating the show's clichés or telling the ill-defined Temporal Cold War story before a mid-course correction that came too little too late. Instead this is a story of humanity reaching out for the stars with hope and perseverance, always at the brink of the known. It's what Star Trek, and Enterprise especially, is at its best though I can only wish we had gotten more episodes like this.",7
4,"""Star Trek: Enterprise"" First Flight (TV Episode 2003)",Good Back History,"Captain Archer gets news that a man named Robinson has died in a mountain climbing accident. It turns out this man was really important to him, and he is very emotional about the death. Archer decides to explore a nebula and T'Pol insists on joining him. On the way, Archer tells her who Robinson was and why he was so important. It turns out that Archer and Robinson were both hotshot pilots and when Archer's dad built the first warp engine for the earth travelers, Robinson was chosen to take the first test flight. He's a hard head and causes the ship to fall apart, barely escaping with his life. This leads to the Vulcans wanting to put the kabosh on the earth's space program. Most of the episode is about what the two of them do when they hear the program has been postponed indefinitely. It's a nice change of pace episode.",7
5,"""Star Trek: Enterprise"" First Flight (TV Episode 2003)",Archer's First Flight,"""First Flight"" is a flashback episode, taking us back to the earlier years of Star Fleet when Earth was still trying to build up its warp program. This flashback is given to us in the form of a story by Captain Archer to T'Pol when he learns of the death of his old friend/rival. We get a little bit of insight into how the program started, Archer's back story, and why he is the captain of the Enterprise today. This is the type of episode I'd like to see more of in the next two seasons of ST:E. We get a closer look at the program and even get to see how Archer and Trip meet which is nice. I wasn't a huge fan of the format, taking us back to present day and the nebula T'Pol and Archer were exploring. It took me completely out of it and distracted from the more important plotline. Just staying in the past the entire episode would have worked better. From this it seemed like Archer has always been a bit of a prideful guy, taking exception for not being chosen for the first flight. At times, he sure can be not very likeable. I also cringed at the terrible ""taking a Vulcan with you"" joke they make in the flashback. Can the writers wink at the audience anymore than that?Conclusion: This episode isn't exactly fantastic but its enjoyable enough.",6
0,"""Star Trek: Enterprise"" Bounty (TV Episode 2003)",I'm Sure Many Will Find It Objectationable,"With Archer, for every action, there is an equal and opposite reaction. Now it's the Klingons who want to get him back after his escape from the penal colony. He is captured by a bounty hunter who is living with some bad judgment in the past. At first the guy is stone cold and indifferent to the pleadings of Archer (some might think he would put him someplace where he can't complain), then he begins to soften a bit. He feels the Klingons will play fair with him. The Enterprise has to work hard to locate their captain. Meanwhile, returning from an exploratory search, Phlox and T'Pol are in a decontamination chamber, getting cleaned up, but a virus of some sort has invaded their bodies. Obviously, this is an exploitative event because T'Pol goes into a premature mating cycle, but must remain, isolated with Phlox, who is having a hard time dealing with it. Still, the story is interesting and so is this event, even if it could be interpreted as eye-candy for the males.",7
1,"""Star Trek: Enterprise"" Bounty (TV Episode 2003)",The Bounty Hunter and the Pon Far,"The Enterprise crew is in shore leave in an uninhabited planet, when a Tellarite ship hails and her Captain Skalaar asks for Captain Archer. He is kidnapped while welcoming Skalaar on board, and finds that the Tellarite is a bounty hunter working for the Klingons that intend to send him back to the penal colony. Meanwhile, T'Pol and Phlox return from the planet infected by a resistant bacteria and while in quarantine, the metabolism of T'Pol is affected and she unexpectedly enters in the Pon Far, asking Phlox to ""help"" her.In ""Bounty"", Captain Archer is abducted again but succeeds to escape. However, this episode is dedicated to T'Pol, more precisely to the sexy Jolene Blalock, who has a very erotic performance. Surprisingly Dr. Phlox adheres to the human morality and does not use a non-orthodox treatment to heal T'Pol, what is an inconsistency with his principles. My vote is eight.Title (Brazil): ""Recompensa"" (""Bounty"")",8
2,"""Star Trek: Enterprise"" Bounty (TV Episode 2003)",Lowers the Bar,"This disjointed, exploitative episode is probably the worst of Enterprise's second season, and its awfulness is compounded by the fact that it immediately followed the excellent ""First Flight"". Archer is kidnapped (again) and threatened with return to a Klingon penal colony. T'Pol and Phlox are infected with a microbe which has caused T'Pol to enter Pon Far. This is, of course, just a set up for showing a lot of Jolene Blalock's skin and indulging the audience's prurient interests. Pon Far will kill her unless she mates and she is in quarantine with Phlox, who is, despite his several open marriages, characterized as a prude.... huh? Blalock's acting is fair, and she sometimes seems very uncomfortable with what she is expected to do. The rest of the plot receives relatively little attention. A good episode to skip. Filler.",3
3,"""Star Trek: Enterprise"" Bounty (TV Episode 2003)",Horny Vulcan alert!!,"kidnapped by Tellarite, Phlox and T'Pol in quarantine when mating urge sets in --Pon Farr --mate or die exploitativeThis is not a particularly good episode of ""Star Trek: Enterprise""-- mostly because the show seems highly sensationalistic and titillating instead of being intelligently written. When the show begins, Trip and Archer are attacked and Archer is taken prisoner by a Tellarite. It seems that the Klingons put a bounty on him after he escaped from their custody (""Judgment"", episode 2, 19). Much of the episode consists of their voyage across space to meet up with the Klingons.The other plot is a doozy that will probably appeal to very horny teenagers but is frankly very embarrassing. When T'Pol and Phlox go on a mission, some strange infection necessitates keeping themselves in isolation--but the same infection has somehow induced Pon Farr-- the Vulcan mating urge. Through most of the show, T'Pol is an incredibly frisky lady and demands the Doctor service her! And, throughout all this, she's nearly naked. This plot is in many ways a low point for the show, as it bowed to prurient content instead of something a bit more high-minded and enlightening!The first plot isn't bad--that's why the show manages to score a 4.",4
4,"""Star Trek: Enterprise"" Bounty (TV Episode 2003)",Not the worst episode but damn close,"Mild Spoilers ahead: Welcome to Skinamax, Star Trek Style. Let's forget for a moment that Jolene Blylock is not particularly sexy (Don't confuse slutty with sexy, they are two different things), we're led to believe she has prematurely entered the Pon Farr - the equivalent of 'going into heat' for the Vulcans. The Original Series establishes that only Vulcan males enter Pon Farr and they must return to their home world to mate or they will die. T'Pol is neither male nor does the Enterprise return to Vulcan to prevent her death. Instead Blylock is used as a pin-up fantasy by lazy writers to illicit fan-boy lust. Oh, there was another storyline this episode, something about a bounty. I guess that's why the episode is named Bounty, but the viewer isn't expected to care much about that. This one is clearly all about the awkward sexual tension between Phlox and T'pol in which neither actor can really stay in character because they both clearly feel dirty and used. Only 'Night in Sickbay' is worse than this one.",3
5,"""Star Trek: Enterprise"" Bounty (TV Episode 2003)",Archer Goes Full Rambo,"In ""Bounty"", Captain Archer's troubles with the Klingon Empire finally catch up with him as he is captured by a bounty hunter seeking the Klingon's reward for the bounty on Archer's head. Back on Enterprise, a microbe has caused T'Pol's mating cycle to prematurely commence. Her emotions are frayed and her hormones uncontrollable. It's up to Dr. Phlox to cure her. This one isn't one of the better episodes of Season 2. The plot involving T'Pol's illness felt like an excuse to sexualize T'Pol and it wasn't appreciated. A Vulcan having sexuality is fine but not the way T'Pol's portrayed in this episode. I could do without anymore like that. Archer's subplot is more interesting but doesn't make a whole lot of sense. If this bounty hunter is piloting this ""piece of junk"" as he calls it, how in the world is it able to disable the Enterprise? It's practically a shuttle! Then Archer decides to instigate things further with the Vulcans by agreeing to this hairbrained scheme straight out of The Good, the Bad, and the Ugly where he allows his new friend to collect the bounty on him before escaping capture. It seemed far too risky to attempt. I guess the main plot development in this one that Archer has now strained even further his relationship with the Klingons. I wouldn't be surprised if they send they're own people after him now. He's enemy number one as far as they're concerned.",4
0,"""Star Trek: Enterprise"" The Expanse (TV Episode 2003)","Season-ending cliffhanger succeeds, but scores low in originality","""The Expanse"" assembles a mystery and a cliffhanger to predictably end the second season of Enterprise. An automated weapon which Archer believes to be a Xindi probe enters Earth-space and cuts a swath from Florida to Venezuela,killing millions. Archer is contacted by an emissary from the future and told that an invasion is being prepared in the Delphic Expanse - a region of space which the Vulcans, and seemingly everybody else, are terrified of. Meanwhile, the Klingon fugitive subplot is kept alive as Enterprise is pursued by Klingon Birds of Prey (this is really just added to provide some additional action in an otherwise sedate episode, since it has no bearing on the central plot), and Enterprise is refitted with better hull plating and antimatter torpedoes (completely scientifically absurd, but the franchise hasn't really been very concerned with science since DS9 so who cares).The acting is a touch above the average for this series. The script allows Conner Trinnear to capitalize on American emotions surrounding the 9/11 attack on the U.S.A., as he turns in one of his finest performances during this series. Jolene Blalock also does a very nice job with one of T'Pol's more complicated early interpretations (this character has one of the best arcs in the series, and becomes much more interesting in the 3rd and 4th seasons). However, the script does not just follow franchise formulae, but almost plagiarizes the film Event Horizon in its exposition on the Delphic Expanse.Entirely predictable, but worth watching because it sets up a good Season 3 opener ""The Xindi"", and an excellent story arc within the expanse itself.",6
1,"""Star Trek: Enterprise"" The Expanse (TV Episode 2003)",Full of Action Episode,"An unknown alien probe cuts a slice of 4,000 km length from Florida to Venezuela, killing seven million people. The Enterprise is ordered by Admiral Forrest to return to Earth, but Captain Archer is abducted by Silik with the intention to give a message of an emissary from the future. He tells Archer that the Xindi , from the mysterious and dangerous Delphic Expanse, are preparing to attack Earth. Archer succeeds to convince the Starfleet to enhance the Enterprise and let him travel to the Delphic Expanse, under the protest of the Vulcans. Meanwhile Trip grieves the death of his sister Elizabeth, while The Klingon Captain Duras pursues the Enterprise with the intention of capturing Archer.""The Expanse"" is a full of action episode, but not totally original. I am curious about how the physics laws work in the spot based on the advice of Sival. T'Pol quits her commission with the Vulcan High Command to follow with the Enterprise, showing a great loyalty to Captain Archer. My vote is eight.Title (Brazil): ""A Expansão"" (""The Expansion"")",8
2,"""Star Trek: Enterprise"" The Expanse (TV Episode 2003)",An exquisite episode,"This rich,ample episode involves a Xindi probe,a moving,sober,exquisitely acted scene with Archer and T'Pol,a battle with the Klingons,a scene of everyday life on board the ""Enterprise"",the introduction of a mysterious,even horrible zone,the Delphic Expanse.One of the most grandiose and vast episodes of the whole series.Six things that make this episode so excellent,well-grounded and well-timed:(1)A Xindi probe,that slaughters,massacres millions of men;(2)the very first evidences for the time travel,a most thrilling subject;(3)The Delphic Expanse;(4)an intense scene performed by Bakula and Miss Blalock;both give heartfelt performances;(5)Archer and a mate having a drink,at night,and talking;nothing extraordinary,but so very human about these two guys having a drink and talking about a loss;(6) a wild confrontation between ""Enterprise"" and a Klingon ""Bird"".",
