,episode,rev_title,rev_content,rvr_rating
10,"""Star Trek: Enterprise"" These Are the Voyages... (TV Episode 2005)",Yes... It really was that bad!!!,"I don't normally post to these type of boards but the finale was so bad, I had to put my two cents in. I can't say I am a die hard trekkie but I started becoming more of a fan with TNG. I was excited about this series until I heard that they cast Bakula as a captain, I thought this was probably a dismal failure to begin with so I never really gave it much of a chance. I didn't want to see the Quantum Leap guy on the bridge. I guess I needed more time to digest it. It wasn't until recently, (2012), that I decided to watched the ""streamed series"" of Enterprise, (hey it's still a new series for me to watch so give me a break! LOL)Overall, I began to grow fond of Scott as a captain, he seemed to settle into the captains chair nicely. To my amazement, I actually enjoyed all the crew and their traits seemed to fit them well. In my opinion, this franchise was lost in season 4 and I blame the writers. Somewhere around the episode with the orion women things started falling apart. You can tell it even in the crews acting that they were not thrilled with how things were going.The whole Xindi season was stellar, it's too bad they couldn't do the same for season 4 and arc another big mission of an entire season.Season four was a waste of streaming bandwidth. And then... the final episode... OMG!I always loved Riker and Troi but they should have never been cast to this episode. Look, we are all getting older, and I rather remember these two as young heros. Troi, well.... she's still got it but they made her up way too heavy. Riker... I love ya man but we both put on some weight and some wrinkles over the years. The least they could have done was get you a new TNG uniform that fit you versus stuffing you in the same one you use to use back in the 80's. Also, a little Just For Men wouldn't have hurt either. This was not how I want to remember my TNG heros.I get the fact that the season came to an abrupt end, but the whole deal being packaged the way it was, in my opinion, did a huge discredit the entire NX-01 crew/actors. A holodeck program? Killing Trip? A large #1 with a side of Troi? WTF, when did they ever mention that they confide in the chef?I would have rather seen the crew of Enterprise be the focal point and not stand in the shadows of the TNG stars. If they needed to whip out a finale, they should have taken clips and mixed them in with interviews of the enterprise actors, funniest moments, etc. At least that would have been an appropriate send off.Nothing but love for the entire cast of Enterprise. You got a raw deal in the end and every knows it. Thanks for a great show while it lasted.",1
11,"""Star Trek: Enterprise"" These Are the Voyages... (TV Episode 2005)",If History Serves to Remind,"Never post to internet, what you don't want haunting you, forever. That statement also has a prequel.Never put together a series finale, where fans still roil in pain at its mentioning decades later.So where we are, nearly a decade after the finale of this flawed but curiously interesting series?Still furious, still steaming. And wishing we could execute Shatner's imperative, to ""get a life"" beyond Trek.In short, if this finale was a B and B ""Valentine"" to the fans, consider what might happen if you showed up on Valentine's day with a vacuum cleaner as a gift in lieu of flowers. Would it not be a disaster you'd never get over, never hear the end of no matter how much time has passed? Well, here we are!How bad was this finale? I hope they end the series with Blu-Ray 4th Season at Terra Prime, and isolate this last episode into some ""Epilogue"" extra with lots of mea culpa secondary tracts by B and B and the cast--of the original Enterprise. As to this episode, what utter betrayal to both artists and fans.During the four year run I got past the totally inappropriate theme music, the titillation of a Spock with boobs, another heavily accented engineer, the counter McCoy smiley Doc Phlox - as arcs in the last year were getting interestingly past alien of the week. Much has been correctly made of the marginalization of the entire cast and crew by framing this episode, nay, entire series, inside a holodeck dream TNG sequence overseen by middle aged, chubby Riker sporting Shatner's old hairpiece.What was the throwaway death of Trip about? So Archer could make a meeting on time? What a B and B sop to studio execs and their meetings, why folks would sacrifice lives to have their leaders make one! All that build up to a speech never recited! All the hope between Trip/T'Pal dashed.Certainly real life doesn't work happily ever after, there's real tragedy, folks die, people move on. But our fiction, however dark, is more a place where we like to imbue closure and what the world should look like. Even ""Lost"" had folks dieing happily ever after and many of us thought that ending was tripe and pandering. But this Enterprise finale plot goes down in history, as the Dallas dream sequence that brought back brother Bobby to the living did, as one of the off putting in TV history. I mirror Blalock's comments. ""Crap"". ""Appalling"". It marginalized everyone by reducing them to stand ins on a TNG holodeck. It was as if B and B were saying, OK, we struggled with these plot lines, but you didn't support us with a big enough fan base to make this commercially successful, we'll get you for that. We'll show you. For investing in these characters, our last lines will be ""it's only a dream, it isn't ""real"". That'll fix ya!Yup. Just a dream. But some nightmares haunt forever.",1
12,"""Star Trek: Enterprise"" These Are the Voyages... (TV Episode 2005)",insulting,"This episode was an insult to the very spirit of Star Trek, not to mention the cast of Star Trek: Enterprise itself. I don't know what Berman and Braga were thinking when they wrote this episode. I don't know whether they thought it would actually read as a proper send-off to the series. I am not them. What I do know is that the entire episode reeked of a hastily constructed ""screw you!"" to the fans. Over the course of the hour most of the plot development established over the series is completely torn apart and replaced with an insane ""watch Johnathan Frakes try REALLY HARD to look 20 years younger!"" variety show where the cast of Enterprise comes in one by one to talk to him about their problems.And did I mention that the story was completely insipid? No? Well, it was. It might have made a cute episode of the series, but the fact that it was the series finale and, by extension, somewhat of a ""farewell"" to the entire franchise, made it nothing short of horrifying. And I won't get into the end of the episode, but it was the visual equivalent of Rick Berman himself coming into your house and punching you in the nose and then saying ""THANKS FOR WATCHIN'!"" Those of you that have seen it know what I mean.My advice? Watch season one of enterprise, then skip over season two. Then watch seasons three and four up to ""Terra Prime."" That was a proper send-off to the series, not this piece of crap.",1
13,"""Star Trek: Enterprise"" These Are the Voyages... (TV Episode 2005)",Ouch,"I refused to watch the 'so-called' final episode of Enterprise when it came out. I bought the series on DVD and in a last minute decision put on the B&B finale. I wish I could unsee it. I won't go into a repeated opinion of what many many other fans have said about how awful it was, let me just say that they are absolutely correct about what an insult this is to Enterprise fans and the cast.Something else that's never mentioned is that there are some people who are not TNG fans. With the exception of 2 episodes I hated the series and the crew for that matter except Picard, yet I understood its fan types and would have felt bad for them if the final episode of their series had been ruined in such a fashion as mine was. Having to watch Riker and Troi parade around as the main characters to the finale of another casts show was really an extra sting to many Enterprise fans and non-TNG fanboys. Sirtis and Frakes should have had the decency and common sense to realize what they were doing and opted to not do the episode. B&B are morons and I expect little from them and although this episode was horrible I can't honestly say I'm surprised they did it. Sirtis and Frakes, however, I'm disappointed with as I have enjoyed their works 'other' than TNG and they have now dropped into the 'feeder fish' category.",1
14,"""Star Trek: Enterprise"" These Are the Voyages... (TV Episode 2005)",I regret watching the final episode,"It was such a nice series and this final episode just ruins it. So Trip has to die because they suddenly couldn't handle a bunch of second rate villains? How very unlikely. The captain and the crew are usually so cool, calm and collected and now this? That's what bothers me the most, but it's not the only thing. Suddenly we get to meet the chef who, apparently, was a sort of counselor all these years. He wasn't even mentioned once. Mixing all these Next Generation elements could have been fine in any other random episode, but not as the series finale. In the episode preceding the finale you see Trip all sad because the baby died, but also that he might be willing to have another one with T'Pol. That might have been a good ending. Next episode they suddenly haven't seen each other in years. Really weird.I'm sorry I ever watched it.",1
15,"""Star Trek: Enterprise"" These Are the Voyages... (TV Episode 2005)",An insult to the Enterprise cast!,"The series left a lot to be desired. So I didn't watch it that much. But I was hoping for a decent ending so I tuned in.But instead, they made it into a ""lost scene"" of the ST:TNG episode ""Pegasus"" and a crappy one at that. I like CDRs Riker and Troi, but hey, this was not their show! This episode revolved around them! Pathetic! I tried watching the show (ST:Enterprise) several times and even got into it a little when those Space Marines joined the crew. But every time I got into it, the show got bland again.The final episode was a chance to mend fences and make things right before warping into cancellation, to make the characters really shine before departing the airwaves.But no, oh no. They (writers and producers) appeared to do the ""desparate act"" and include past Trek characters to try to attract the old fans. They might have attracted the old fans, but the final product they got was substandard!",1
16,"""Star Trek: Enterprise"" These Are the Voyages... (TV Episode 2005)","Braga had promised ""Valentine to the fans"" – if you throw stones at girlfriend or wife on Valentines Day, he wasn't lying","It had been a rather rough and bumpy ride over the last four seasons, and by the final episode, there was the distinct certainty, that there would be no more. However, other than in the previous series, there was an air of relief. There had been too little character-development and way too few elements that would have kept the fan rooting for a continuation. Sure, the show had its moments, but those generally came from guest-appearances like Brent Spiner, Paul Weller and especially Jeffrey Combs; and that's no feat of glory when a shows appeal lies in waiting for satisfying guest-stars.But, knowing that the end was nigh, one did hope for a final firework; something to conjure up the magic that made shows like ""The Next Generation"" or ""DS9"" classics of (Science Fiction)-TV. After four seasons, it had become relatively clear that the scriptwriters were true hacks; hence I was ready to bet my head that there would be a guest-appearance from somebody from the prior series. But who would it be? Sure, it would have been far-fetched to expect Patrick Steward or Leonard Nimoy to appear and shake Captain Archers Hand (and as said: Spiner had already made his appearance), but perhaps Geordie LaForge? After all, LeVar Burton had directed a couple of episodes. Maybe Worf, Odo or Captain Sisko from ""DS9""? ""All too good for the likes of our audience"", the producer (presumably) mumbled to himself and cast the needy-looking host from ""X-Factor"" as special-guest. Hey, none of us is getting younger or handsomer (with the exception of Sophia Loren perhaps, but that's another story) and far be it from me to deny Jonathan Frakes a handful of dollars; mans got to eat and pay the rent. But the final episode of a ""Star Trek""-series should aspire to grandness, not inspire pity and next to Will Shatner himself, Frakes is the definition of washed-out has-been.Now, apart from the pointless, detracting ""guest-appearance"", what else did the screenwriters have in store for this celebration? The subplot of Shrans kidnapped daughter might have made a mediocre-to-alright episode, but for the final episode it simply raised the stink of lackluster, lazy screen writing which had plagued roughly 70 percent of the show.But perhaps I'm being too pessimistic; perhaps my expectation are too high and I should tell myself that it could have been much worst: they could have shown Picard and Riker playing a computer-game in the intro, blowing up the Enterprise, telling us that it was all a game in the holodeck all along, followed by a montage of Kirk fighting the Gorm, digitally stretched to 40 minutes.Ach, who am I kidding? Should have gone out with a big bang – went out with the noise of flatulence.",2
17,"""Star Trek: Enterprise"" These Are the Voyages... (TV Episode 2005)",Even IMDb takes a shot at this disgraceful finale.,"I won't recapitulate all the negative reviews of this horrible episode (with which I agree, incidentally); however, I noticed that even IMDb subtly disapproves, listing all the cast of ""Enterprise"" with the designation ""(hologram)"" next to their characters' names, suggesting it was as if...there weren't really even there. Touche! The fact is, the B&B send off reduced the cast of ""Enterprise"" to ghostly afterthoughts, not unlike hologram characters -- photonic images created by the bending of light, and not fully-formed, fleshed out characters. The cast that dedicated four years of their respective careers deserved much better than to be pushed to one side (WAY to one side!) to make way for the bulky Riker and Troi.A disgrace. (I gave it a four, simply because I liked the Shran story line, and Jeffrey Combs is always a welcome presence.)",4
18,"""Star Trek: Enterprise"" These Are the Voyages... (TV Episode 2005)",Barely Worth Watching,"Why bring Riker and Troi into this. The crew could have gone out in a blaze of glory with a script that was imaginative and exciting. We are pretty much told what happened and the characters act it out, stiffly and with little aplomb. This series was a bit inconsistent, at least in its first half, but the episodes became much more complex and creative in the second half. The final dual episode preceding this was one of the best of all. So we throw in this lame thing. I got to know these people, their trials and their accomplishments, and ""The Next Generation"" takes over with people telling Riker dull things as he pretends to be a chef. What a letdown.",4
19,"""Star Trek: Enterprise"" These Are the Voyages... (TV Episode 2005)",One of many missed opportunities,"In what would have been a fine premise for a standard episode, Riker's uncertainties in the Holodeck simply blemished the Enterprise farewell. The death of Tripp left me feeling as violated as a drive-by shooting witness. Senseless and gratuitous, it still baffles me that this seemed like a good idea to anybody. The episode, arguably the worst of the four year run, probably contributes to the trepidation of Paramount in allowing a new TV series to this day. All of that being said, I don't HATE it. It is Star Trek, and it features people that I've enjoyed for years. Hopefully, any new adaptation in the Star Trek universe will put this episode into perspective as a teachable moment and the producers will remember rule number one. The fans are the only reason that Star Trek exists. Abusing their loyalty will have repercussions.",3
20,"""Star Trek: Enterprise"" These Are the Voyages... (TV Episode 2005)",Seemed like Holodeck fanfiction instead of an actual ending,"This episode was just plain bad,It jumps ahead 6 years, yet the ship and crew look the same, indicating literally nothing of interest happened. Most of the cast are little more then extra's in this episode with next to no dialogueThe story of Trip and T'pol, which had been building up for 2 seasons is suddenly cast aside for no apparent reason, which also undermines the ending of the previous episode in which the death of Elizabeth drew them together. 2 seasons of buildup (including a now mind-link) which is just tossed aside with a casual line here.Shran is inserted out of nowhere, faked his death, has a child and quite a lot of other throwaway lines instead of actual plot on how this came to be.Trip's death was just plain insulting and completely unrealistic and so tacked on that made it seems like it never happened and Troi just added it in there for Riker's ""lesson"". The Pirates were stated to be in a slower ship, yet somehow caught up with no explanation. They somehow not only reached the ship virtually undetected and unopposed, but also got to the heart of the ship without any effort and held Archer at gunpoint again with no opposition. Where were the MAKO's, security or any other defense against a ship stated vastly inferior to Enterprise.Riker apparently did this simulation purely for the moment Trip defied orders and killed himself. The rest of the episode had nothing to do with this moment and the situation was in no way comparable to his own. Not to mention there are quite a few ""order defying"" moments in earlier episodes that served that purpose far better.Then we get Trip supposedly dying while under Phlox's care, which not only lacked any kind of emotion to it (Trip winking didn't help) but an actual death is NOT shown and T'pol is missing.Finally we have Troi ruining the episode multiple times. She says Trip will die 20 minutes before he does (why on earth was that line added) and she hypes up Archer's speech yet we never hear it. In the end this episode just came of as a non-canon Holodeck novel and not the actual events, mainly due to aspects happening that literally couldn't happen. The crew couldn't be identical 6 years later and Trip couldn't have died because those pirates couldn't reach the ship due to a huge difference in warp capabilities and they certainly couldn't enter the ship completely unopposed.",1
21,"""Star Trek: Enterprise"" These Are the Voyages... (TV Episode 2005)",terrible ending!,the worst episode of the whole show! so the enterprise are just a Holden program on the next generation? this is too much and why i doubt they Will ever make a new star trek TV series too bad for the series the ruined it whit this ending liked in a mirror darkly!ding! i liked in a mirror darkly!i liked in i liked in a mirror darkly!a mirror darkly!i liked in a mirror liked in a mirror darkly! darkly! i liked in a Miro liked in a mirror darkly!roar darkly! i liked in a mirror darkly! i liked in a mirror darkly! i liked in a mirror darkly! i liked in a mirror darkly! i liked in a mirror darkly! i liked in a mirror darkly!,1
22,"""Star Trek: Enterprise"" These Are the Voyages... (TV Episode 2005)","Good Episode, Bad Series Finale, very bad writer.","Braga HAS written some fine scripts, in general I like his ideas, but not here.I'm not really giving the actual episode ""5"" stars-It was a fine, well produced episode. I'm giving Brannon Braga a -5, so it evens out to a ""5."" This guy was handed the reigns of ST:TNG and he drove in into the ground, ruining all of the progress made by better writers.It has been said that Brannon Braga blew up the Enterprise D, ""Because it didn't look very good in 16:9 aspect ratio""-Looks fine here though. Actually it looks Freakin' FANTASTIC, even for a Digital ""Model."" And that's the problem: ALL of the Next Generation scenes looked great, as good or better than TNG. But the problem is, this was NOT ""Star Trek: The Next Generation""Our two Next Gen crewmen, Troi and Riker, well for one thing they do NOT look like they did when ""The Pegasus"" was filmed, back in 1994? Marina could have pulled it off, if they had stayed away from all facial close-ups: In long shots, she actually looked pretty similar to her 1994 Doppelganger. But Riker, this is not the same Frakes that used to be called ""Ensign Babyface""- Had they done something like this around the time ""Insurrection"" was being made, he could have pulled it off, but in 2005, it was impossible.If this had been a stand alone Episode, earlier in the season, it would have been good and true Homage to ST:TNG, a nice salute. But here, at the end of Enterprise, it is a kick in Enterprise Crew's face.The framed ""Enterprise"" story was not really a good enough story to be the ""Last Mission"" and Tripp, having survived The Xindi and The Suliban, would not have let those Alien Gangbangers get the drop on him and Archer, so I don't believe that either. And I also did not believe there was a character called ""Cook"" that was a kind of 'Ship's Counsellor"" for 10 years? It's not that I didn't like the idea, and the way this was written, it was actually a Holodeck fantasy of Riker's, so he could interact with the crew of NX-01.What really bugs me is that Braga forgets canon, including the parts he wrote himself: When we watch ""The Pegasus,"" what was Will Riker doing right before? He WAS NOT on the Holodeck indulging himself: He was doing Calisthenics with WORF, and he Injured Himself. So I want to know, WHEN did this happen. Also, he never did tell Picard or Troi about the Pegasus or Admiral Pressman's agenda: He said nothing to anyone until he blew his stack after the Romulan Ship had disrupted them into the asteroid! But Ron D Moore wrote that episode, and this is an insult to him as well.So it was not only Enterprise ""canon"" that Braga ignored and wrecked, it was Next Generation canon as well.As far as the ""Enterprise"" Holodeck fantasy which was being played out, I guess it had ""something to do with the day the United Federation of Planets"" actually became a viable entity. Of course, which is what this episode should have been about. But THAT story was not told. Or rather, it was told, in several of the arcs from seasons 1 through 4. But it was not told HERE-It was not wrapped up here. The only reference to it was the final scene.So, thanks a lot, Braggo: For wrecking not only Enterprise, but also The Original Series, Next Generation, Deep Space Nine, and even Voyager as well.EDIT: After Binge-Watching season 3, which I had never seen, I can safely assume, we can ignore this dud ""finale"": they could have saved Trip by making a new Sim and then fixing his life-span, like Sim suggested in ""Similitude"". Screw Braga.",5
23,"""Star Trek: Enterprise"" These Are the Voyages... (TV Episode 2005)",Assumes everybody has watched 'The Next Generation',"Sadly 'Enterprise' was doomed to be cancelled after a mere four seasons and although this episode was clearly designed to be the finale it feels more like a regular story that was slightly modified to make it the finale. Set several years after the previous episode the Enterprise is on its way back to Earth for the last time before being decommissioned. On the way they receive a call from Shren who was missing presumed dead; he wants Capt. Archers help as he has fallen in with some dubious characters and they have kidnapped his daughter and are demanding he return a huge jewel they believe he stole. As he did not steal it and they don't believe him he will have to take her back by force. The mission to rescue his daughter goes to plan but her erstwhile kidnappers are determined to get Shren and board Enterprise. Trip has an idea to neutralise them but in doing so he puts himself in grave danger. If this was the whole story it would be fine but it isn't told like a regular episode of 'Enterprise'; instead it is a holodeck program being played by Commander Riker aboard Picard's Enterprise. He is having a dilemma about breaking a promise regarding a treaty violation by the Federation and Councillor Troi has suggested he look at how things were done in the past.I liked the main story concerning Shren's daughter but couldn't see why it had to be told as a holodeck record watched by Will Riker. He even took the role of the ship's chef as we all know the crew of Archer's Enterprise liked to confide in the chef at least we would if he had been mentioned before! Having the last episode of 'Enterprise' linked to the crew of 'Star Trek: The Next Generation' like this just cheapened it and made it seem as if the characters we'd grown to care about over the last four seasons didn't matter. It's not that I don't like the characters of Riker and Troi; I just don't think they belong in this series after all it is quite likely that some people watching this will never have seen 'The Next Generation'. That wasn't the only problem, they also decided to kill off a main character, an odd choice for a final episode but even odder was telling us this person was going to die before it happened so there was no sense of shock when it did happen. Overall it was quite a disappointment; the series deserved a better send off.",5
